"dream_text","interpretation"
"Dreaming of a dragon ascending","Signifies great honor, imperial favor, or the birth of a talented child."
"Dreaming of a phoenix flying","Represents marital harmony, prosperity, and auspicious events."
"Dreaming of a tiger roaring","Warns of fierce rivals or upcoming disputes in the family."
"Dreaming of a snake entering the house","Indicates hidden wealth or unexpected gains."
"Dreaming of fish leaping from water","Foretells pregnancy, abundance, or career advancement."
"Dreaming of teeth falling out without pain","Means minor family troubles or loss of small possessions."
"Dreaming of flying over mountains","Signifies overcoming obstacles and achieving high status."
"Dreaming of falling into water","Warns of health issues or emotional overwhelm."
"Dreaming of heavy rain","Indicates relief from worries or cleansing of misfortunes."
"Dreaming of the sun setting","Foretells decline in fortune or end of a prosperous period."
"Dreaming of the moon eclipsed","Symbolizes family separation or feminine misfortunes."
"Dreaming of climbing a tall mountain","Represents hard work leading to success and stability."
"Dreaming of clear river water","Signifies smooth wealth and peaceful journeys."
"Dreaming of fire in the home","Means family warmth but warns of potential arguments."
"Dreaming of strong winds","Foretells major changes or news from distant relatives."
"Dreaming of blooming trees","Indicates family growth, new births, or business success."
"Dreaming of wilted flowers","Warns of health decline or romantic disappointments."
"Dreaming of eating ripe fruit","Signifies good health, longevity, and satisfaction."
"Dreaming of finding gold","Foretells sudden riches but beware of envy."
"Dreaming of a sharp sword","Represents authority and victory in conflicts."
"Dreaming of a broken mirror","Means shattered illusions or relationship breaks."
"Dreaming of a sturdy house","Symbolizes family security and long-term stability."
"Dreaming of building a bridge","Signifies resolving disputes or connecting with others."
"Dreaming of meeting an emperor","Foretells promotions or encounters with powerful allies."
"Dreaming of a joyous wedding","Means harmonious unions or family celebrations."
"Dreaming of giving birth","Represents new opportunities or creative endeavors."
"Dreaming of one's own death","Signifies longevity and rebirth from troubles."
"Dreaming of friendly ghosts","Indicates ancestral protection or resolved past issues."
"Dreaming of benevolent gods","Foretells divine blessings and good fortune."
"Dreaming of a white horse","Symbolizes purity, swift success, or loyal friends."
"Dreaming of a black cat","Warns of deceit, bad luck, or hidden enemies."
"Dreaming of birds singing","Means joyful news or harmonious relationships."
"Dreaming of catching fish","Foretells profits from efforts or family additions."
"Dreaming of a loyal dog","Represents faithful companions or protection from harm."
"Dreaming of insects crawling","Warns of small annoyances or health irritations."
"Dreaming of spiders weaving webs","Symbolizes creative traps or intricate plans."
"Dreaming of fresh flowers","Indicates beauty, romance, or fleeting happiness."
"Dreaming of harvesting vegetables","Means rewards from hard work and good health."
"Dreaming of drinking clear water","Signifies emotional clarity and fulfillment."
"Dreaming of swimming upstream","Represents struggling against challenges for success."
"Dreaming of jumping over a gap","Signifies taking risks leading to advancement."
"Dreaming of running from danger","Means escaping troubles or urgent warnings."
"Dreaming of walking on a path","Indicates steady progress toward goals."
"Dreaming of dancing in joy","Symbolizes celebration, harmony, or release of stress."
"Dreaming of crying alone","Represents emotional release or hidden sorrows."
"Dreaming of fighting a foe","Means inner conflicts or external rivalries."
"Dreaming of winning a prize","Signifies triumph over difficulties."
"Dreaming of losing valuables","Warns of financial setbacks or carelessness."
"Dreaming of traveling far","Represents life changes or explorations."
"Dreaming of riding a boat","Indicates navigating emotions smoothly."
"Dreaming of a dense forest","Symbolizes confusion or hidden opportunities."
"Dreaming of a barren desert","Means endurance through hardships."
"Dreaming of a calm ocean","Represents deep subconscious peace."
"Dreaming of a bustling city","Indicates social opportunities or chaos."
"Dreaming of a quiet village","Means community support and simplicity."
"Dreaming of a fruitful farm","Signifies productivity and family nourishment."
"Dreaming of a beautiful garden","Symbolizes personal growth and beauty."
"Dreaming of reading books","Indicates gaining wisdom or knowledge."
"Dreaming of writing letters","Means important communications or news."
"Dreaming of gold jewelry","Foretells wealth and high status."
"Dreaming of silver coins","Symbolizes intuition and minor gains."
"Dreaming of red colors","Indicates passion, warnings, or energy."
"Dreaming of blue skies","Means calm, trust, and serenity."
"Dreaming of green fields","Signifies growth, healing, or envy."
"Dreaming of yellow flowers","Represents happiness or caution."
"Dreaming of black shadows","Warns of mystery or unknown fears."
"Dreaming of white clouds","Indicates purity and new beginnings."
"Dreaming of pregnancy","Foretells creative ideas or family expansion."
"Dreaming of family gatherings","Means support or potential conflicts."
"Dreaming of strangers helping","Signifies unexpected opportunities."
"Dreaming of monsters chasing","Represents inner fears or demons."
"Dreaming of angels descending","Foretells protection and guidance."
"Dreaming of gods speaking","Means inspiration or divine favor."
"Dreaming of a lion","Symbolizes strength, but warns of powerful adversaries."
"Dreaming of an elephant","Indicates wisdom and long memory."
"Dreaming of a monkey","Means mischief or clever deceptions."
"Dreaming of a rabbit","Foretells fertility or quick escapes."
"Dreaming of a wolf","Warns of treachery or lone struggles."
"Dreaming of a deer","Signifies grace and peaceful pursuits."
"Dreaming of a bear","Represents raw power or hibernation."
"Dreaming of a fox","Means cunning and potential betrayal."
"Dreaming of a cow","Symbolizes abundance and nurturing."
"Dreaming of a sheep","Indicates docility or following crowds."
"Dreaming of thunder","Warns of sudden shocks or divine anger."
"Dreaming of lightning","Signifies enlightenment or destruction."
"Dreaming of snow","Means purity but warns of cold relations."
"Dreaming of fog","Represents confusion or hidden truths."
"Dreaming of earthquakes","Foretells major upheavals."
"Dreaming of volcanoes","Symbolizes explosive emotions."
"Dreaming of stars falling","Warns of lost hopes or changes."
"Dreaming of comets","Indicates rare events or omens."
"Dreaming of a ring","Signifies commitments or cycles."
"Dreaming of a hat","Means roles or authority."
"Dreaming of a fan","Represents cooling tempers or flirtation."
"Dreaming of a umbrella","Symbolizes protection from troubles."
"Dreaming of a clock stopping","Warns of time running out."
"Dreaming of a ladder","Means ascent or descent in status."
"Dreaming of a window","Indicates perspectives or opportunities."
"Dreaming of a bed","Represents rest or intimacy."
"Dreaming of a chair","Symbolizes stability or waiting."
"Dreaming of a table","Means gatherings or decisions."
"Dreaming of ears hearing whispers","Signifies secrets or gossip."
"Dreaming of nose bleeding","Warns of health loss or shame."
"Dreaming of mouth speaking","Represents communication or lies."
"Dreaming of feet walking bare","Means humility or journeys."
"Dreaming of arms embracing","Symbolizes relationships or strength."
"Dreaming of legs running","Indicates haste or pursuit."
"Dreaming of heart beating fast","Warns of anxiety or passion."
"Dreaming of blood flowing","Means vitality or family bonds."
"Dreaming of bones breaking","Signifies structural failures."
"Dreaming of skin peeling","Represents renewal or exposure."
"Dreaming of hiding","Means avoidance or secrets."
"Dreaming of searching","Indicates quests or losses."
"Dreaming of finding treasure","Signifies hidden talents or gains."
"Dreaming of losing way","Warns of confusion or wrong paths."
"Dreaming of arguing","Means unresolved tensions."
"Dreaming of reconciling","Symbolizes peace and harmony."
"Dreaming of studying","Represents learning or preparation."
"Dreaming of teaching","Indicates sharing wisdom."
"Dreaming of playing games","Means leisure or competitions."
"Dreaming of working hard","Signifies rewards from effort."
"Dreaming of resting","Warns of laziness or needed recovery."
"Dreaming of a king","Foretells leadership or judgments."
"Dreaming of a queen","Symbolizes feminine power or grace."
"Dreaming of soldiers","Means conflicts or discipline."
"Dreaming of farmers","Represents hard work and harvests."
"Dreaming of merchants","Indicates trades or profits."
"Dreaming of children playing","Signifies innocence and joy."
"Dreaming of elders advising","Means wisdom from ancestors."
"Dreaming of lovers meeting","Symbolizes romance or unions."
"Dreaming of enemies reconciling","Foretells peace."
"Dreaming of festivals","Indicates celebrations or abundance."
"Dreaming of funerals","Means endings or longevity."
"Dreaming of banquets","Signifies social gains or indulgences."
"Dreaming of demons","Warns of temptations or evils."
"Dreaming of fairies","Foretells magic or good luck."
"Dreaming of heaven","Symbolizes ascension or rewards."
"Dreaming of hell","Means sufferings or warnings."
"Dreaming of prayers","Indicates spiritual needs or fulfillments."
"Dreaming of sacrifices","Represents offerings or losses."
"Dreaming of spells","Warns of illusions or controls."
"Dreaming of orange fruits","Signifies vitality and warnings."
"Dreaming of purple robes","Means royalty or mystery."
"Dreaming of brown earth","Represents grounding or stability."
"Dreaming of pink blossoms","Indicates tenderness or romance."
"Dreaming of gray mists","Warns of uncertainty."
"Dreaming of colorful rainbows","Foretells hopes and promises."
"Dreaming of cooking rice","Means daily sustenance and family."
"Dreaming of eating meat","Signifies strength or indulgences."
"Dreaming of drinking wine","Represents joy or excesses."
"Dreaming of temples","Indicates spiritual refuge or vows."
"Dreaming of palaces","Symbolizes luxury or ambitions."
"Dreaming of caves","Means hidden secrets or retreats."
"Dreaming of towers","Represents aspirations or isolations."
"Dreaming of gates opening","Signifies new paths."
"Dreaming of walls crumbling","Warns of defenses failing."
"Dreaming of smiling","Means contentment or deceptions."
"Dreaming of frowning","Indicates worries or displeasures."
"Dreaming of fear","Represents unresolved anxieties."
"Dreaming of anger","Means suppressed conflicts."
"Dreaming of love","Signifies emotional fulfillments."
"Dreaming of hate","Warns of enmities."
"Dreaming of surprise","Indicates unexpected events."
"Dreaming of boredom","Means stagnation or needs for change."
"Dreaming of a white tiger","Symbolizes rare power and protection."
"Dreaming of a golden phoenix","Foretells extraordinary good fortune."
"Dreaming of a venomous snake","Warns of toxic relationships."
"Dreaming of colorful fish","Means diverse opportunities."
"Dreaming of loose teeth","Indicates communication issues."
"Dreaming of flying with birds","Signifies freedom and companionship."
"Dreaming of falling leaves","Represents seasonal changes or losses."
"Dreaming of torrential rain","Means overwhelming relief."
"Dreaming of bright sun","Foretells enlightenment."
"Dreaming of full moon","Symbolizes completeness."
"Dreaming of steep mountains","Warns of tough challenges."
"Dreaming of flooding rivers","Indicates emotional overflows."
"Dreaming of controlled fire","Means managed passions."
"Dreaming of gentle winds","Foretells pleasant news."
"Dreaming of fruiting trees","Signifies bountiful rewards."
"Dreaming of vibrant flowers","Indicates thriving relationships."
"Dreaming of sour fruit","Warns of disappointments."
"Dreaming of buried gold","Means undiscovered wealth."
"Dreaming of rusty sword","Symbolizes weakened authority."
"Dreaming of clear mirror","Represents truth revelation."
"Dreaming of old house","Indicates past memories."
"Dreaming of new bridge","Signifies fresh connections."
"Dreaming of wise emperor","Foretells guidance."
"Dreaming of lavish wedding","Means prosperous unions."
"Dreaming of twin births","Represents doubled blessings."
"Dreaming of peaceful death","Signifies serene transitions."
"Dreaming of scary ghosts","Warns of hauntings."
"Dreaming of protective gods","Foretells safety."
"Dreaming of wild horse","Means untamed energies."
"Dreaming of stray cat","Indicates independence."
"Dreaming of nesting birds","Symbolizes home building."
"Dreaming of big fish","Foretells major gains."
"Dreaming of guard dog","Represents security."
"Dreaming of flying insects","Warns of fleeting annoyances."
"Dreaming of spider bites","Means entanglements."
"Dreaming of wilted flowers","Indicates fading joys."
"Dreaming of rotten vegetables","Warns of neglect."
"Dreaming of thirsty drinking","Signifies unmet needs."
"Dreaming of effortless swimming","Means easy navigations."
"Dreaming of high jumping","Represents bold leaps."
"Dreaming of endless running","Indicates pursuits."
"Dreaming of straight walking","Means clear directions."
"Dreaming of group dancing","Symbolizes unity."
"Dreaming of silent crying","Represents inner pains."
"Dreaming of fair fighting","Means resolutions."
"Dreaming of easy winning","Signifies advantages."
"Dreaming of avoidable losing","Warns of mistakes."
"Dreaming of adventurous traveling","Represents discoveries."
"Dreaming of sinking boat","Means emotional sinks."
"Dreaming of dark forest","Symbolizes mysteries."
"Dreaming of oasis in desert","Indicates reliefs."
"Dreaming of stormy ocean","Warns of turmoils."
"Dreaming of ancient city","Means heritages."
"Dreaming of remote village","Represents roots."
"Dreaming of empty farm","Warns of scarcities."
"Dreaming of overgrown garden","Indicates neglects."
"Dreaming of ancient books","Means old wisdoms."
"Dreaming of sealed letters","Symbolizes secrets."
"Dreaming of fine jewelry","Foretells elegances."
"Dreaming of tarnished silver","Warns of deceptions."
"Dreaming of vivid red","Indicates intensities."
"Dreaming of deep blue","Means profundities."
"Dreaming of lush green","Signifies vitalities."
"Dreaming of pale yellow","Warns of weaknesses."
"Dreaming of pure black","Represents unknowns."
"Dreaming of bright white","Indicates clarities."
"Dreaming of false pregnancy","Means illusions."
"Dreaming of large family","Symbolizes supports."
"Dreaming of helpful strangers","Foretells aids."
"Dreaming of tamed monsters","Means conquered fears."
"Dreaming of singing angels","Signifies joys."
"Dreaming of silent gods","Warns of ignorances."
"Dreaming of eagle soaring","Represents ambitions."
"Dreaming of owl hooting","Means wisdoms or deaths."
"Dreaming of peacock displaying","Indicates vanities."
"Dreaming of pigeon returning","Foretells messages."
"Dreaming of crow cawing","Warns of bad news."
"Dreaming of swan gliding","Symbolizes graces."
"Dreaming of bee stinging","Means small pains."
"Dreaming of butterfly flying","Represents transformations."
"Dreaming of ant colony","Indicates diligences."
"Dreaming of scorpion","Warns of stings."
"Dreaming of hailstorm","Means sudden damages."
"Dreaming of rainbow after rain","Foretells hopes."
"Dreaming of dew on grass","Signifies fresh starts."
"Dreaming of frost","Warns of coldnesses."
"Dreaming of tsunami","Indicates overwhelms."
"Dreaming of meteor shower","Means wishes or falls."
"Dreaming of constellation","Symbolizes guidances."
"Dreaming of necklace","Represents bonds."
"Dreaming of bracelet","Means constraints or beauties."
"Dreaming of earrings","Indicates listenings."
"Dreaming of crown","Foretells rulers."
"Dreaming of rope","Symbolizes ties or escapes."
"Dreaming of chain","Means bondages."
"Dreaming of lock","Warns of securities."
"Dreaming of candle burning","Represents hopes."
"Dreaming of lamp lighting","Signifies illuminations."
"Dreaming of vase breaking","Means fragilities."
"Dreaming of pot boiling","Indicates preparations."
"Dreaming of bowl full","Symbolizes abundances."
"Dreaming of lungs breathing","Represents vitalities."
"Dreaming of liver aching","Warns of angers."
"Dreaming of stomach empty","Means hungers."
"Dreaming of back turning","Indicates betrayals."
"Dreaming of neck stiff","Warns of stubbornnesses."
"Dreaming of fingers pointing","Means accusations."
"Dreaming of toes stepping","Represents progresses."
"Dreaming of brain thinking","Signifies intellects."
"Dreaming of veins pulsing","Symbolizes lives."
"Dreaming of muscles straining","Means efforts."
"Dreaming of whispering","Indicates secrets."
"Dreaming of shouting","Warns of urgencies."
"Dreaming of singing songs","Means expressions."
"Dreaming of silence","Represents peaces or isolations."
"Dreaming of applauding","Signifies approvals."
"Dreaming of booing","Warns of disapprovals."
"Dreaming of negotiating","Means compromises."
"Dreaming of commanding","Represents authorities."
"Dreaming of obeying","Symbolizes submissions."
"Dreaming of rebelling","Warns of upheavals."
"Dreaming of meditating","Indicates inner peaces."
"Dreaming of priest","Means spiritual guidances."
"Dreaming of monk","Represents renunciations."
"Dreaming of warrior","Signifies battles."
"Dreaming of scholar","Means knowledges."
"Dreaming of artist","Indicates creations."
"Dreaming of baby crying","Warns of needs."
"Dreaming of teenager rebelling","Means growth pains."
"Dreaming of adult working","Represents responsibilities."
"Dreaming of old man dying","Signifies wisdom passings."
"Dreaming of crowd gathering","Means social events."
"Dreaming of solitude","Warns of lonelinesses."
"Dreaming of betrayal","Indicates distrusts."
"Dreaming of loyalty","Symbolizes strengths."
"Dreaming of harvest festival","Foretells abundances."
"Dreaming of mourning ceremony","Means closures."
"Dreaming of birthday party","Signifies renewals."
"Dreaming of evil spirits","Warns of corruptions."
"Dreaming of mythical creatures","Represents imaginations."
"Dreaming of paradise","Foretells bliss."
"Dreaming of purgatory","Means purifications."
"Dreaming of chanting mantras","Indicates protections."
"Dreaming of curses","Warns of harms."
"Dreaming of blessings","Signifies favors."
"Dreaming of indigo dyes","Means depths."
"Dreaming of violet flowers","Represents spiritualities."
"Dreaming of beige sands","Indicates neutralities."
"Dreaming of teal waters","Means calms."
"Dreaming of magenta skies","Foretells passions."
"Dreaming of monochrome scenes","Warns of dullnesses."
"Dreaming of baking bread","Signifies comforts."
"Dreaming of spicy foods","Means excitements."
"Dreaming of sweet desserts","Represents indulgences."
"Dreaming of bitter herbs","Warns of hardships."
"Dreaming of sacred mountains","Foretells pilgrimages."
"Dreaming of ruined temples","Means lost faiths."
"Dreaming of underground caves","Represents subconsciouses."
"Dreaming of high towers","Signifies isolations or views."
"Dreaming of locked gates","Warns of barriers."
"Dreaming of fortified walls","Means defenses."
"Dreaming of contentment","Indicates satisfactions."
"Dreaming of despair","Warns of lows."
"Dreaming of excitement","Means anticipations."
"Dreaming of calmness","Represents tranquilities."
"Dreaming of confusion","Indicates disorientations."
"Dreaming of clarity","Signifies understandings."
"Dreaming of regret","Warns of past mistakes."
"Dreaming of hope","Foretells positives."
"Dreaming of a silver dragon","Symbolizes mystical protections."
"Dreaming of a fire phoenix","Means rebirths from ashes."
"Dreaming of a coiled snake","Warns of dormant threats."
"Dreaming of glowing fish","Foretells enlightenments."
"Dreaming of bleeding teeth","Indicates severe losses."
"Dreaming of soaring flight","Signifies liberations."
"Dreaming of endless falling","Means insecurities."
"Dreaming of drizzling rain","Represents gentle cleansings."
"Dreaming of eclipsed sun","Warns of temporary darknesses."
"Dreaming of crescent moon","Symbolizes growths."
"Dreaming of volcanic mountains","Indicates eruptions."
"Dreaming of frozen rivers","Means stalled progresses."
"Dreaming of wildfire","Warns of uncontrolled destructions."
"Dreaming of whirlwind","Foretells chaoses."
"Dreaming of dead trees","Represents endings."
"Dreaming of poisoned flowers","Means deceptions."
"Dreaming of exotic fruit","Signifies rare pleasures."
"Dreaming of stolen gold","Warns of thefts."
"Dreaming of enchanted sword","Symbolizes magics."
"Dreaming of distorted mirror","Means self-deceptions."
"Dreaming of haunted house","Warns of past traumas."
"Dreaming of iron bridge","Represents durabilities."
"Dreaming of tyrant emperor","Means oppressions."
"Dreaming of disrupted wedding","Warns of disunities."
"Dreaming of stillbirth","Indicates failed starts."
"Dreaming of violent death","Means abrupt changes."
"Dreaming of vengeful ghosts","Warns of revenges."
"Dreaming of wrathful gods","Foretells punishments."
"Dreaming of galloping horse","Signifies speeds."
"Dreaming of hunting cat","Means pursuits."
"Dreaming of migrating birds","Represents journeys."
"Dreaming of schooling fish","Symbolizes unities."
"Dreaming of barking dog","Warns of alerts."
"Dreaming of swarming insects","Means plagues."
"Dreaming of trapping spiders","Indicates controls."
"Dreaming of seasonal flowers","Signifies cycles."
"Dreaming of wild vegetables","Represents freedoms."
"Dreaming of poisoned drinking","Warns of betrayals."
"Dreaming of drowning while swimming","Means failures."
"Dreaming of failed jumping","Warns of falls."
"Dreaming of tired running","Indicates exhaustions."
"Dreaming of lost walking","Means wanderings."
"Dreaming of solo dancing","Represents self-expressions."
"Dreaming of bitter crying","Signifies griefs."
"Dreaming of desperate fighting","Means struggles."
"Dreaming of lucky winning","Foretells fortunes."
"Dreaming of irretrievable losing","Warns of despairs."
"Dreaming of perilous traveling","Indicates risks."
"Dreaming of capsized boat","Means disasters."
"Dreaming of enchanted forest","Symbolizes illusions."
"Dreaming of endless desert","Represents endurances."
"Dreaming of infinite ocean","Means vastnesses."
"Dreaming of ruined city","Warns of declines."
"Dreaming of abandoned village","Indicates isolations."
"Dreaming of flooded farm","Means losses."
"Dreaming of secret garden","Signifies privacies."
"Dreaming of forbidden books","Warns of dangers."
"Dreaming of urgent letters","Means emergencies."
"Dreaming of cursed jewelry","Indicates burdens."
"Dreaming of fake silver","Warns of illusions."
"Dreaming of blood red","Means violences."
"Dreaming of ocean blue","Represents depths."
"Dreaming of poison green","Warns of envies."
"Dreaming of sunny yellow","Signifies joys."
"Dreaming of midnight black","Means fears."
"Dreaming of snowy white","Indicates purities."
"Dreaming of complicated pregnancy","Warns of difficulties."
"Dreaming of dysfunctional family","Means disharmonies."
"Dreaming of suspicious strangers","Warns of deceptions."
"Dreaming of defeated monsters","Signifies victories."
"Dreaming of guiding angels","Foretells paths."
"Dreaming of merciful gods","Means forgivenesses."
